0x00: 0x00
0x01: 0xB1
0x03: 0x80
0x04: 0x07
0x05: 0x00
0x0A: 0x0000
0x0F: 0x0000
0x14: 0x0000
0x1D: 0x40
0x22: 0x00
0x23: 0x00
0x25: 0x7D
0x26: 0x00
0x27: 0x00
0x28: 0x00
0x29: 0x03
0x2A: 0x00
0x2B: 0x00
0x2C: 0x00
0x2D: 0x00
0x2E: 0x0007
0x30: 0x00
0x31: 0x0000
0x33: 0x00
0x34: 0x0000
0x36: 0x00
0x37: 0x0000
0x39: 0x40
0x3A: 0x01
0x3B: 0x01
0x3C: 0x00
0x3D: 0x80
0x3E: 0x30
0x40: 0x00
0x41: 0x21
0x4A: 0x00
0x4B: 0x00
0x52: 0x04
0x53: 0x04
0x54: 0xFF
0x56: 0x00
0x57: 0x00
0x58: 0xB8
0x59: 0x04
0x5A: 0x00
0x5B: 0x0000
0x5D: 0x0000
0x6B: 0x0000
0x6D: 0x0000
0x7B: 0xFF
0x7C: 0x080F
0x7E: 0x0008
0x80: 0x000A
0x82: 0x03
0x87: 0x00
0x88: 0x00
0x89: 0x00
0x8A: 0x000000
0xE1: 0x63
0xE5: 0x0000
0xEA: 0x00B3
0xEF: 0x00
0xF0: 0x00
0xF1: 0x03
0xF2: 0x00
0xF3: 0x00
0xF4: 0x03
0xF5: 0x00
0xF6: 0x000000
0xFB: 0x00